{
  "$schema": "https://liftradar.eu/schema/resort.schema.json",
  "id": "dachstein-west",
  "country": "at",
  "name": "Dachstein West",
  "region": "Salzburg",
  "location": {
    "lat": 47.5167,
    "lon": 13.4333
  },
  "status": "closed",
  "fetched_at": "2026-10-28T17:09:29.531923+01:00",
  "status_from": null,
  "snow": {
    "mountain_cm": null,
    "valley_cm": null,
    "fresh_cm": null,
    "last_snowfall": null,
    "condition": null,
    "stations": []
  },
  "lifts": {
    "open": 0,
    "total": 22
  },
  "slopes": {
    "open": 0,
    "total": 48,
    "open_km": 0.0,
    "total_km": 51
  },
  "lifts_by_type": {
    "cable_car": {
      "open": 0,
      "total": 1
    },
    "carpet": {
      "open": 0,
      "total": 3
    },
    "chairlift": {
      "open": 0,
      "total": 9
    },
    "drag_lift": {
      "open": 0,
      "total": 5
    },
    "gondola": {
      "open": 0,
      "total": 4
    }
  },
  "slopes_by_difficulty": {
    "ski_route": {
      "open": 0,
      "total": 6,
      "open_km": 0.0,
      "total_km": null
    },
    "easy": {
      "open": 0,
      "total": 13,
      "open_km": 0.0,
      "total_km": null
    },
    "intermediate": {
      "open": 0,
      "total": 26,
      "open_km": 0.0,
      "total_km": null
    },
    "difficult": {
      "open": 0,
      "total": 3,
      "open_km": 0.0,
      "total_km": null
    }
  },
  "lifts_updated_at": "2026-10-28T10:25:22+01:00",
  "avalanche": null,
  "sources": [
    "https://www.salzburgerland.com/de/schneebericht/",
    "https://winter.intermaps.com/dachstein_west/data?lang=en"
  ],
  "errors": []
}
