{
  "$schema": "https://liftradar.eu/schema/resort.schema.json",
  "id": "hakarinteet",
  "country": "fi",
  "name": "Häkärinteet",
  "region": "Keski-Suomi",
  "location": {
    "lat": 62.3507,
    "lon": 26.6142
  },
  "website": "https://hakarinteet.fi",
  "status": "no_report",
  "fetched_at": "2026-10-28T21:35:31.430766+01:00",
  "status_from": null,
  "snow": {
    "mountain_cm": null,
    "valley_cm": null,
    "fresh_cm": null,
    "last_snowfall": null,
    "condition": null,
    "stations": []
  },
  "lifts": {
    "open": 0,
    "total": 4
  },
  "slopes": {
    "open": null,
    "total": 11,
    "open_km": null,
    "total_km": null
  },
  "lifts_by_type": null,
  "slopes_by_difficulty": {
    "easy": {
      "open": null,
      "total": 8,
      "open_km": null,
      "total_km": null
    },
    "intermediate": {
      "open": null,
      "total": 2,
      "open_km": null,
      "total_km": null
    },
    "difficult": {
      "open": null,
      "total": 1,
      "open_km": null,
      "total_km": null
    }
  },
  "lifts_updated_at": null,
  "avalanche": null,
  "sources": [
    "https://ski.fi/hiihtokeskukset/hakarinteet/",
    "https://ski.fi/hiihtokeskukset/"
  ],
  "errors": []
}
