{
  "$schema": "https://liftradar.eu/schema/resort.schema.json",
  "id": "willingen",
  "country": "de",
  "name": "Willingen",
  "region": "Hessen",
  "location": {
    "lat": 51.2866,
    "lon": 8.6023
  },
  "status": "no_report",
  "fetched_at": "2026-10-28T17:09:24.863250+01:00",
  "status_from": null,
  "snow": {
    "mountain_cm": null,
    "valley_cm": null,
    "fresh_cm": null,
    "last_snowfall": null,
    "condition": null,
    "stations": []
  },
  "lifts": {
    "open": 0,
    "total": 16
  },
  "slopes": {
    "open": null,
    "total": null,
    "open_km": null,
    "total_km": 14
  },
  "lifts_by_type": null,
  "slopes_by_difficulty": null,
  "lifts_updated_at": null,
  "avalanche": null,
  "sources": [
    "https://www.outdooractive.com/de/skiresort/rothaargebirge/skigebiet-willingen/1737795/"
  ],
  "errors": []
}
