{
  "$schema": "https://liftradar.eu/schema/resort.schema.json",
  "id": "usseln",
  "country": "de",
  "name": "Usseln",
  "region": "Hessen",
  "location": {
    "lat": 51.2816,
    "lon": 8.6658
  },
  "website": "https://www.skilift-emmet.de",
  "status": "closed",
  "fetched_at": "2026-10-29T14:10:05.932988+01:00",
  "status_from": null,
  "snow": {
    "mountain_cm": null,
    "valley_cm": null,
    "fresh_cm": null,
    "last_snowfall": null,
    "condition": null,
    "stations": []
  },
  "lifts": {
    "open": 0,
    "total": 3
  },
  "slopes": null,
  "lifts_by_type": null,
  "slopes_by_difficulty": null,
  "lifts_updated_at": null,
  "avalanche": null,
  "sources": [
    "https://www.wintersport-arena.de/skifahren-boarden/skigebiete-und-schneehoehen"
  ],
  "errors": []
}
