{
  "$schema": "https://liftradar.eu/schema/resort.schema.json",
  "id": "alto-campoo",
  "country": "es",
  "name": "Alto Campoo",
  "region": "Cantabria",
  "location": {
    "lat": 43.0338,
    "lon": -4.3573
  },
  "website": "https://altocampoo.com",
  "status": "no_report",
  "fetched_at": "2026-10-30T18:46:54.139605+01:00",
  "status_from": null,
  "snow": {
    "mountain_cm": null,
    "valley_cm": null,
    "fresh_cm": null,
    "last_snowfall": null,
    "condition": null,
    "stations": []
  },
  "lifts": {
    "open": 0,
    "total": 10
  },
  "slopes": {
    "open": null,
    "total": 23,
    "open_km": null,
    "total_km": 24
  },
  "lifts_by_type": null,
  "slopes_by_difficulty": null,
  "lifts_updated_at": null,
  "avalanche": null,
  "sources": [
    "https://altocampoo.com/pistas-y-remontes/"
  ],
  "errors": []
}
