{
  "$schema": "https://liftradar.eu/schema/resort.schema.json",
  "id": "skiwelt",
  "country": "at",
  "name": "SkiWelt Wilder Kaiser - Brixental",
  "region": "Tirol",
  "location": {
    "lat": 47.5022,
    "lon": 12.193
  },
  "website": "https://www.skiwelt.at",
  "status": "closed",
  "fetched_at": "2026-10-30T15:09:35.225456+01:00",
  "status_from": null,
  "snow": {
    "mountain_cm": null,
    "valley_cm": null,
    "fresh_cm": null,
    "last_snowfall": "2026-04-01",
    "condition": null,
    "stations": []
  },
  "lifts": {
    "open": 0,
    "total": 135
  },
  "slopes": {
    "open": 0,
    "total": 221,
    "open_km": 0.0,
    "total_km": 275
  },
  "lifts_by_type": {
    "cable_car": {
      "open": 0,
      "total": 8
    },
    "carpet": {
      "open": 0,
      "total": 11
    },
    "chairlift": {
      "open": 0,
      "total": 61
    },
    "drag_lift": {
      "open": 0,
      "total": 34
    },
    "gondola": {
      "open": 0,
      "total": 21
    }
  },
  "slopes_by_difficulty": {
    "ski_route": {
      "open": 0,
      "total": 17,
      "open_km": 0.0,
      "total_km": null
    },
    "easy": {
      "open": 0,
      "total": 96,
      "open_km": 0.0,
      "total_km": null
    },
    "intermediate": {
      "open": 0,
      "total": 87,
      "open_km": 0.0,
      "total_km": null
    },
    "difficult": {
      "open": 0,
      "total": 21,
      "open_km": 0.0,
      "total_km": null
    }
  },
  "lifts_updated_at": "2026-10-30T15:03:18+01:00",
  "avalanche": null,
  "sources": [
    "https://www.snowcard.tirol.at/skigebiet/Brixen%20im%20Thale%20-%20SkiWelt_58",
    "https://winter.intermaps.com/skiwelt/data?lang=en",
    "https://media.skiwelt.at/media/pressetexte/allgemeine-infos-zur-skiwelt-wilder-kaiser-brixental-winter2025-26.pdf"
  ],
  "errors": []
}
