{
  "$schema": "https://liftradar.eu/schema/resort.schema.json",
  "id": "joehstadt",
  "country": "de",
  "name": "Jöhstadt (Am Gründelwald)",
  "region": "Sachsen",
  "location": {
    "lat": 50.5378,
    "lon": 13.1372
  },
  "status": "no_report",
  "fetched_at": "2026-10-28T19:08:23.682462+01:00",
  "status_from": null,
  "snow": {
    "mountain_cm": null,
    "valley_cm": null,
    "fresh_cm": null,
    "last_snowfall": null,
    "condition": null,
    "stations": []
  },
  "lifts": null,
  "slopes": null,
  "lifts_by_type": null,
  "slopes_by_difficulty": null,
  "lifts_updated_at": null,
  "avalanche": null,
  "sources": [],
  "errors": []
}
