{
  "$schema": "https://liftradar.eu/schema/resort.schema.json",
  "id": "tschappina",
  "country": "ch",
  "name": "Tschappina",
  "region": "Graubünden",
  "location": {
    "lat": 46.6921,
    "lon": 9.3605
  },
  "status": "no_report",
  "fetched_at": "2026-10-27T21:26:45.569444+01:00",
  "snow": {
    "mountain_cm": null,
    "valley_cm": null,
    "fresh_cm": null,
    "last_snowfall": null,
    "condition": null,
    "stations": []
  },
  "lifts": {
    "open": 0,
    "total": 4
  },
  "slopes": {
    "open": null,
    "total": 11,
    "open_km": null,
    "total_km": 25
  },
  "lifts_by_type": {
    "drag_lift": {
      "open": 0,
      "total": 4
    }
  },
  "slopes_by_difficulty": {
    "easy": {
      "open": null,
      "total": 3,
      "open_km": null,
      "total_km": null
    },
    "intermediate": {
      "open": null,
      "total": 8,
      "open_km": null,
      "total_km": null
    }
  },
  "lifts_updated_at": "2026-04-07T07:38:00+02:00",
  "avalanche": null,
  "sources": [
    "https://infosnow.ch/portal/?type=ajax-raw&tab=map-1/dlg-sys&lang=en&e=84&saison=1&ref=contentBox",
    "https://www.skiinfo.fr/les-grisons/tschappina-heinzenberg/station-de-ski"
  ],
  "errors": []
}
