{
  "$schema": "https://liftradar.eu/schema/resort.schema.json",
  "id": "vierli",
  "country": "no",
  "name": "Vierli - Rauland",
  "region": "Telemark",
  "location": {
    "lat": 59.7264,
    "lon": 8.1357
  },
  "website": "https://visitrauland.com/vierli/",
  "status": "no_report",
  "fetched_at": "2026-10-31T08:41:16.411833+01:00",
  "status_from": null,
  "snow": {
    "mountain_cm": null,
    "valley_cm": null,
    "fresh_cm": null,
    "last_snowfall": null,
    "condition": null,
    "stations": []
  },
  "lifts": {
    "open": 0,
    "total": 5
  },
  "slopes": {
    "open": null,
    "total": null,
    "open_km": null,
    "total_km": 9
  },
  "lifts_by_type": null,
  "slopes_by_difficulty": null,
  "lifts_updated_at": null,
  "avalanche": {
    "region_id": "NO-3035",
    "region": "Vest-Telemark",
    "danger_level": null,
    "danger": null,
    "ratings": [
      {
        "level": "no_snow",
        "lower_bound": null,
        "upper_bound": null,
        "period": "all_day"
      }
    ],
    "problems": [],
    "published_at": "2026-10-31T00:00:00+01:00",
    "valid_from": "2026-10-31T00:00:00+01:00",
    "valid_until": "2026-10-31T23:59:59+01:00"
  },
  "sources": [
    "https://www.skiresort.com/en/ski-resort/vierli-rauland/",
    "https://static.avalanche.report/eaws_bulletins/2026-10-31/2026-10-31-NO.json"
  ],
  "errors": []
}
