{
  "$schema": "https://liftradar.eu/schema/resort.schema.json",
  "id": "soelden",
  "country": "at",
  "name": "Sölden",
  "region": "Tirol",
  "location": {
    "lat": 46.95,
    "lon": 10.98
  },
  "website": "https://www.soelden.com",
  "status": "open",
  "fetched_at": "2026-10-29T18:39:27.618898+01:00",
  "status_from": null,
  "snow": {
    "mountain_cm": 0,
    "valley_cm": 0,
    "fresh_cm": 0,
    "last_snowfall": "2026-10-25",
    "condition": "Powder - grippy",
    "stations": [
      {
        "name": "Sölden",
        "elevation_m": 1363,
        "depth_cm": 0,
        "fresh_cm": 0,
        "temperature_c": 8.0,
        "condition": null
      },
      {
        "name": "Gaislachkogl",
        "elevation_m": 2110,
        "depth_cm": 0,
        "fresh_cm": 0,
        "temperature_c": -1.9,
        "condition": null
      },
      {
        "name": "Giggijoch",
        "elevation_m": 2525,
        "depth_cm": 0,
        "fresh_cm": 0,
        "temperature_c": -1.6,
        "condition": null
      },
      {
        "name": "Glacier",
        "elevation_m": 3000,
        "depth_cm": 0,
        "fresh_cm": 0,
        "temperature_c": -3.7,
        "condition": "Powder - grippy"
      }
    ]
  },
  "lifts": {
    "open": 9,
    "total": 31
  },
  "slopes": {
    "open": 6,
    "total": 58,
    "open_km": 30.9,
    "total_km": 147
  },
  "lifts_by_type": {
    "carpet": {
      "open": 1,
      "total": 2
    },
    "chairlift": {
      "open": 1,
      "total": 13
    },
    "drag_lift": {
      "open": 3,
      "total": 7
    },
    "funicular": {
      "open": 1,
      "total": 1
    },
    "gondola": {
      "open": 3,
      "total": 8
    }
  },
  "slopes_by_difficulty": {
    "ski_route": {
      "open": 0,
      "total": 13,
      "open_km": 0.0,
      "total_km": 7
    },
    "easy": {
      "open": 5,
      "total": 21,
      "open_km": 28.5,
      "total_km": 78
    },
    "intermediate": {
      "open": 0,
      "total": 15,
      "open_km": 0.0,
      "total_km": 37
    },
    "difficult": {
      "open": 1,
      "total": 9,
      "open_km": 2.4,
      "total_km": 23
    }
  },
  "lifts_updated_at": "2026-10-29T18:36:46+01:00",
  "avalanche": null,
  "sources": [
    "https://www.soelden.com/en/live-information/snow-report",
    "https://winter.intermaps.com/soelden/data?lang=en",
    "https://www.soelden.com/en/activities/winter/skiing-snowboarding/ski-area-information"
  ],
  "errors": []
}
