{
  "$schema": "https://liftradar.eu/schema/resort.schema.json",
  "id": "radstadt-altenmarkt",
  "country": "at",
  "name": "Radstadt - Altenmarkt",
  "region": "Salzburg",
  "location": {
    "lat": 47.3385,
    "lon": 13.4417
  },
  "status": "closed",
  "fetched_at": "2026-10-28T17:09:29.533177+01:00",
  "status_from": null,
  "snow": {
    "mountain_cm": null,
    "valley_cm": null,
    "fresh_cm": null,
    "last_snowfall": null,
    "condition": null,
    "stations": []
  },
  "lifts": {
    "open": 0,
    "total": 7
  },
  "slopes": {
    "open": 0,
    "total": 9,
    "open_km": null,
    "total_km": 18
  },
  "lifts_by_type": null,
  "slopes_by_difficulty": null,
  "lifts_updated_at": "2026-10-28T14:42:00+01:00",
  "avalanche": null,
  "sources": [
    "https://www.salzburgerland.com/de/schneebericht/",
    "https://www.skiresort.info/ski-resort/radstadt-altenmarkt/",
    "https://www.skiinfo.fr/salzbourg/radstadt-altenmarkt/station-de-ski"
  ],
  "errors": []
}
