{
  "$schema": "https://liftradar.eu/schema/resort.schema.json",
  "id": "czarna-gora",
  "country": "pl",
  "name": "Czarna Góra (Sienna)",
  "region": "Dolnośląskie",
  "location": {
    "lat": 50.2716,
    "lon": 16.8432
  },
  "status": "no_report",
  "fetched_at": "2026-10-27T21:53:33.860063+01:00",
  "status_from": null,
  "snow": {
    "mountain_cm": null,
    "valley_cm": null,
    "fresh_cm": null,
    "last_snowfall": null,
    "condition": null,
    "stations": []
  },
  "lifts": {
    "open": 0,
    "total": 9
  },
  "slopes": {
    "open": null,
    "total": 19,
    "open_km": null,
    "total_km": 12
  },
  "lifts_by_type": null,
  "slopes_by_difficulty": null,
  "lifts_updated_at": null,
  "avalanche": null,
  "sources": [
    "https://czarnagora.pl/komunikat-narciarski/"
  ],
  "errors": []
}
