{
  "$schema": "https://liftradar.eu/schema/resort.schema.json",
  "id": "les-rousses",
  "country": "fr",
  "name": "Les Rousses",
  "region": "Jura",
  "location": {
    "lat": 46.4856,
    "lon": 6.0603
  },
  "website": "https://www.lesrousses.com",
  "status": "no_report",
  "fetched_at": "2026-10-29T14:10:05.931499+01:00",
  "status_from": null,
  "snow": {
    "mountain_cm": null,
    "valley_cm": null,
    "fresh_cm": null,
    "last_snowfall": null,
    "condition": null,
    "stations": []
  },
  "lifts": {
    "open": 0,
    "total": 18
  },
  "slopes": {
    "open": null,
    "total": 25,
    "open_km": null,
    "total_km": 24
  },
  "lifts_by_type": {
    "carpet": {
      "open": 0,
      "total": 1
    },
    "chairlift": {
      "open": 0,
      "total": 6
    },
    "drag_lift": {
      "open": 0,
      "total": 11
    }
  },
  "slopes_by_difficulty": {
    "easy": {
      "open": null,
      "total": 16,
      "open_km": null,
      "total_km": 17
    },
    "intermediate": {
      "open": null,
      "total": 6,
      "open_km": null,
      "total_km": 7
    },
    "difficult": {
      "open": null,
      "total": 3,
      "open_km": null,
      "total_km": 2
    }
  },
  "lifts_updated_at": null,
  "avalanche": null,
  "sources": [
    "https://bulletinv3.lumiplan.pro/bulletin.php?station=les-rousses&lang=fr&isSoir=false",
    "https://public.lumiplay.link/interactive-map/v1/map/name/Les-Rousses-Alpin",
    "https://public.lumiplay.link/interactive-map/v1/map/59462c53-7f75-4e9f-817d-14ff50933363/staticPoiData?lang=fr",
    "https://public.lumiplay.link/interactive-map/v1/map/59462c53-7f75-4e9f-817d-14ff50933363/dynamicPoiData?lang=fr"
  ],
  "errors": []
}
