{
  "$schema": "https://liftradar.eu/schema/resort.schema.json",
  "id": "goldingen",
  "country": "ch",
  "name": "Goldingen (Atzmännig)",
  "region": "St. Gallen",
  "location": {
    "lat": 47.2629,
    "lon": 8.9664
  },
  "status": "no_report",
  "fetched_at": "2026-10-27T21:26:45.568767+01:00",
  "snow": {
    "mountain_cm": null,
    "valley_cm": null,
    "fresh_cm": null,
    "last_snowfall": null,
    "condition": null,
    "stations": []
  },
  "lifts": {
    "open": 0,
    "total": 6
  },
  "slopes": {
    "open": null,
    "total": 11,
    "open_km": null,
    "total_km": 8
  },
  "lifts_by_type": {
    "carpet": {
      "open": 0,
      "total": 2
    },
    "chairlift": {
      "open": 0,
      "total": 1
    },
    "drag_lift": {
      "open": 0,
      "total": 3
    }
  },
  "slopes_by_difficulty": {
    "easy": {
      "open": null,
      "total": 5,
      "open_km": null,
      "total_km": null
    },
    "intermediate": {
      "open": null,
      "total": 6,
      "open_km": null,
      "total_km": null
    }
  },
  "lifts_updated_at": "2026-04-01T00:05:00+02:00",
  "avalanche": null,
  "sources": [
    "https://infosnow.ch/portal/?type=ajax-raw&tab=map-1/dlg-sys&lang=en&e=187&saison=1&ref=contentBox",
    "https://www.skiresort.info/ski-resort/atzmaennig-goldingen/"
  ],
  "errors": []
}
