{
  "$schema": "https://liftradar.eu/schema/resort.schema.json",
  "id": "blomlia",
  "country": "no",
  "name": "Sunnfjord - Blomlia",
  "region": "Vestland",
  "location": {
    "lat": 61.4754,
    "lon": 5.7385
  },
  "website": "https://sunnfjordskisenter.fordeidrettslag.no/",
  "status": "no_report",
  "fetched_at": "2026-10-30T16:15:30.015964+01:00",
  "status_from": null,
  "snow": {
    "mountain_cm": null,
    "valley_cm": null,
    "fresh_cm": null,
    "last_snowfall": null,
    "condition": null,
    "stations": []
  },
  "lifts": {
    "open": 0,
    "total": 3
  },
  "slopes": {
    "open": null,
    "total": null,
    "open_km": null,
    "total_km": 3
  },
  "lifts_by_type": null,
  "slopes_by_difficulty": null,
  "lifts_updated_at": null,
  "avalanche": {
    "region_id": "NO-3027",
    "region": "Indre Fjordane",
    "danger_level": null,
    "danger": null,
    "ratings": [
      {
        "level": "no_snow",
        "lower_bound": null,
        "upper_bound": null,
        "period": "all_day"
      }
    ],
    "problems": [],
    "published_at": "2026-10-30T00:00:00+01:00",
    "valid_from": "2026-10-30T00:00:00+01:00",
    "valid_until": "2026-10-30T23:59:59+01:00"
  },
  "sources": [
    "https://www.skiresort.com/en/ski-resort/sunnfjord-blomlia/",
    "https://static.avalanche.report/eaws_bulletins/2026-10-30/2026-10-30-NO.json"
  ],
  "errors": []
}
