{
  "$schema": "https://liftradar.eu/schema/resort.schema.json",
  "id": "hirschberg-kreuth",
  "country": "de",
  "name": "Hirschberglifte Kreuth",
  "region": "Bayern",
  "location": {
    "lat": 47.6608,
    "lon": 11.6961
  },
  "website": "https://www.hirschberglifte.de",
  "status": "no_report",
  "fetched_at": "2026-10-29T14:42:09.453765+01:00",
  "status_from": null,
  "snow": {
    "mountain_cm": null,
    "valley_cm": null,
    "fresh_cm": null,
    "last_snowfall": null,
    "condition": null,
    "stations": []
  },
  "lifts": null,
  "slopes": null,
  "lifts_by_type": null,
  "slopes_by_difficulty": null,
  "lifts_updated_at": null,
  "avalanche": null,
  "sources": [],
  "errors": []
}
