{
  "$schema": "https://liftradar.eu/schema/resort.schema.json",
  "id": "val-thorens",
  "country": "fr",
  "name": "Val Thorens",
  "region": "Savoie",
  "location": {
    "lat": 45.2979,
    "lon": 6.5823
  },
  "website": "https://www.valthorens.com",
  "status": "no_report",
  "fetched_at": "2026-10-28T21:35:31.429250+01:00",
  "status_from": null,
  "snow": {
    "mountain_cm": null,
    "valley_cm": null,
    "fresh_cm": null,
    "last_snowfall": null,
    "condition": null,
    "stations": []
  },
  "lifts": {
    "open": 0,
    "total": 23
  },
  "slopes": {
    "open": null,
    "total": 75,
    "open_km": null,
    "total_km": 150
  },
  "lifts_by_type": {
    "cable_car": {
      "open": 0,
      "total": 1
    },
    "carpet": {
      "open": 0,
      "total": 3
    },
    "chairlift": {
      "open": 0,
      "total": 9
    },
    "drag_lift": {
      "open": 0,
      "total": 1
    },
    "gondola": {
      "open": 0,
      "total": 9
    }
  },
  "slopes_by_difficulty": {
    "easy": {
      "open": null,
      "total": 42,
      "open_km": null,
      "total_km": null
    },
    "intermediate": {
      "open": null,
      "total": 26,
      "open_km": null,
      "total_km": null
    },
    "difficult": {
      "open": null,
      "total": 7,
      "open_km": null,
      "total_km": null
    }
  },
  "lifts_updated_at": null,
  "avalanche": null,
  "sources": [
    "https://bulletinv3.lumiplan.pro/bulletin.php?station=val-thorens&lang=fr&isSoir=false",
    "https://public.lumiplay.link/interactive-map/v1/map/name/les-3-vallees",
    "https://public.lumiplay.link/interactive-map/v1/map/bd632c91-6957-494d-95a8-6a72eb87e341/staticPoiData?lang=fr",
    "https://public.lumiplay.link/interactive-map/v1/map/bd632c91-6957-494d-95a8-6a72eb87e341/dynamicPoiData?lang=fr",
    "https://www.skiinfo.fr/alpes-du-nord/val-thorens/station-de-ski"
  ],
  "errors": []
}
