{
  "$schema": "https://liftradar.eu/schema/resort.schema.json",
  "id": "spicak-zelezna-ruda",
  "country": "cz",
  "name": "Špičák (Železná Ruda)",
  "region": "Plzeňský kraj",
  "location": {
    "lat": 49.1582,
    "lon": 13.2266
  },
  "status": "closed",
  "fetched_at": "2026-10-28T14:30:24.956233+01:00",
  "status_from": null,
  "snow": {
    "mountain_cm": null,
    "valley_cm": null,
    "fresh_cm": null,
    "last_snowfall": null,
    "condition": null,
    "stations": []
  },
  "lifts": {
    "open": 0,
    "total": 8
  },
  "slopes": {
    "open": 0,
    "total": 16,
    "open_km": 0.0,
    "total_km": 8
  },
  "lifts_by_type": {
    "carpet": {
      "open": 0,
      "total": 1
    },
    "chairlift": {
      "open": 0,
      "total": 1
    },
    "drag_lift": {
      "open": 0,
      "total": 6
    }
  },
  "slopes_by_difficulty": {
    "easy": {
      "open": 0,
      "total": 9,
      "open_km": 0.0,
      "total_km": 4
    },
    "intermediate": {
      "open": 0,
      "total": 5,
      "open_km": 0.0,
      "total_km": 4
    },
    "difficult": {
      "open": 0,
      "total": 2,
      "open_km": 0.0,
      "total_km": 1
    }
  },
  "lifts_updated_at": "2026-10-28T09:29:50+01:00",
  "avalanche": null,
  "sources": [
    "https://zima.holidayinfo.cz/cs/locinfo/zrspicak",
    "https://zima.holidayinfo.cz/hol3_data.php?type=locslopes_data&cntry=1&reg=6&loc=5",
    "https://zima.holidayinfo.cz/hol3_data.php?type=loclifts_data&cntry=1&reg=6&loc=5"
  ],
  "errors": []
}
