{
  "$schema": "https://liftradar.eu/schema/resort.schema.json",
  "id": "brokke",
  "country": "no",
  "name": "Brokke Alpinsenter",
  "region": "Agder",
  "location": {
    "lat": 59.0939,
    "lon": 7.4483
  },
  "website": "http://www.brokke.com",
  "status": "no_report",
  "fetched_at": "2026-10-30T16:15:30.015282+01:00",
  "status_from": null,
  "snow": {
    "mountain_cm": null,
    "valley_cm": null,
    "fresh_cm": null,
    "last_snowfall": null,
    "condition": null,
    "stations": []
  },
  "lifts": {
    "open": 0,
    "total": 4
  },
  "slopes": {
    "open": null,
    "total": 6,
    "open_km": null,
    "total_km": 6
  },
  "lifts_by_type": {
    "chairlift": {
      "open": 0,
      "total": 1
    },
    "drag_lift": {
      "open": 0,
      "total": 2
    },
    "other": {
      "open": 0,
      "total": 1
    }
  },
  "slopes_by_difficulty": {
    "easy": {
      "open": null,
      "total": 4,
      "open_km": null,
      "total_km": null
    },
    "intermediate": {
      "open": null,
      "total": 2,
      "open_km": null,
      "total_km": null
    }
  },
  "lifts_updated_at": "2026-04-26T10:08:11+02:00",
  "avalanche": null,
  "sources": [
    "https://api.fnugg.no/search?size=200",
    "https://fnugg.no/brokke/",
    "https://www.skiresort.com/en/ski-resort/brokke/"
  ],
  "errors": []
}
